lane_key,lane_label,lane_position,summary,temperature,stage,source,channel,lead_id,username,account_name,repo_name,repo_url,company,contact_surface,evidence_score,evidence,motion,offer,why_now,cta,proof_rule,first_touch_draft,pain_confirmed_follow_up_draft,next_tracking_command,pipeline_updated_at
warm_discovery,Warm Discovery,1,Deep_Ad1959 — r/cursor,warm,targeted,reddit,reddit_dm,reddit_deep_ad1959_r_cursor,Deep_Ad1959,r/cursor,,,,https://www.reddit.com/user/Deep_Ad1959/,10,warm inbound engagement; workflow pain named: rollback risk; already in DMs,sprint,workflow_hardening_sprint,"Warm Reddit engager already named a repeated workflow risk, so the fastest path is a founder-led diagnostic.",https://thumbgate-production.up.railway.app/#workflow-sprint-intake,Use proof links only after the buyer confirms the workflow pain.,"Your question about rollback rates when context changes is exactly the right one. I am looking for one AI-agent workflow to harden end-to-end this week: repeated failure, prevention rule, and proof run. If you have one workflow where context drift or rollback risk keeps showing up, I can harden that workflow for you. Worth a 15-minute diagnostic?","If your workflow really has one repeated workflow failure blocking rollout, I can send the Workflow Hardening Sprint brief plus the commercial truth and verification evidence: https://thumbgate-production.up.railway.app/#workflow-sprint-intake Commercial truth: https://github.com/IgorGanapolsky/ThumbGate/blob/main/docs/COMMERCIAL_TRUTH.md Verification evidence: https://github.com/IgorGanapolsky/ThumbGate/blob/main/docs/VERIFICATION_EVIDENCE.md",npm run sales:pipeline -- advance --lead 'reddit_deep_ad1959_r_cursor' --channel 'reddit_dm' --stage 'contacted' --note 'Sent Workflow Hardening Sprint first touch focused on rollback risk.',
warm_discovery,Warm Discovery,2,game-of-kton — r/cursor,warm,targeted,reddit,reddit_dm,reddit_game_of_kton_r_cursor,game-of-kton,r/cursor,,,,https://www.reddit.com/user/game-of-kton/,9,warm inbound engagement; built serious memory systems; workflow pain named: stale context and conflicting facts,sprint,workflow_hardening_sprint,"Warm Reddit engager already works on advanced agent memory, so discovery should center on one repeated failure pattern.",https://thumbgate-production.up.railway.app/#workflow-sprint-intake,Use proof links only after the buyer confirms the workflow pain.,"Your ACT-R engram work is fascinating, especially the conflict resolution for opposing facts and the decay model. I am looking for one serious AI-agent workflow to harden end-to-end this week. If your memory system has one recurring failure mode such as stale context, opposing facts, bad handoffs, or unsafe tool calls, I can turn that into a prevention rule and proof run. Open to a 15-minute diagnostic?","If your workflow really has one repeated workflow failure blocking rollout, I can send the Workflow Hardening Sprint brief plus the commercial truth and verification evidence: https://thumbgate-production.up.railway.app/#workflow-sprint-intake Commercial truth: https://github.com/IgorGanapolsky/ThumbGate/blob/main/docs/COMMERCIAL_TRUTH.md Verification evidence: https://github.com/IgorGanapolsky/ThumbGate/blob/main/docs/VERIFICATION_EVIDENCE.md",npm run sales:pipeline -- advance --lead 'reddit_game_of_kton_r_cursor' --channel 'reddit_dm' --stage 'contacted' --note 'Sent Workflow Hardening Sprint first touch focused on stale context and conflicting facts.',
warm_discovery,Warm Discovery,3,leogodin217 — r/ClaudeCode,warm,targeted,reddit,reddit_dm,reddit_leogodin217_r_claudecode,leogodin217,r/ClaudeCode,,,,https://www.reddit.com/user/leogodin217/,9,warm inbound engagement; mature multi-step workflow described; workflow pain named: review boundaries and context risk,sprint,workflow_hardening_sprint,"Warm Reddit engager already described a mature workflow, so the next step is a targeted diagnostic on one failure mode.",https://thumbgate-production.up.railway.app/#workflow-sprint-intake,Use proof links only after the buyer confirms the workflow pain.,"Your arch-create to sprint workflow is one of the most mature agent processes I have seen anyone describe. I am looking for one AI-agent workflow to harden end-to-end this week. Your workflow already has phases, review boundaries, and context risk, so it is a strong fit: pick one repeating failure and I will help turn it into an enforceable Pre-Action Check plus proof run. Worth 15 minutes?","If your workflow really has one repeated workflow failure blocking rollout, I can send the Workflow Hardening Sprint brief plus the commercial truth and verification evidence: https://thumbgate-production.up.railway.app/#workflow-sprint-intake Commercial truth: https://github.com/IgorGanapolsky/ThumbGate/blob/main/docs/COMMERCIAL_TRUTH.md Verification evidence: https://github.com/IgorGanapolsky/ThumbGate/blob/main/docs/VERIFICATION_EVIDENCE.md",npm run sales:pipeline -- advance --lead 'reddit_leogodin217_r_claudecode' --channel 'reddit_dm' --stage 'contacted' --note 'Sent Workflow Hardening Sprint first touch focused on review boundaries and context risk.',
warm_discovery,Warm Discovery,4,Enthu-Cutlet-1337 — r/ClaudeCode,warm,targeted,reddit,reddit_dm,reddit_enthu_cutlet_1337_r_claudecode,Enthu-Cutlet-1337,r/ClaudeCode,,,,https://www.reddit.com/user/Enthu-Cutlet-1337/,8,warm inbound engagement; responded to adaptive-gate positioning; workflow pain named: brittle guardrails,sprint,workflow_hardening_sprint,"Warm Reddit engager already understands the adaptive-gate thesis, so offer one concrete workflow hardening diagnostic.",https://thumbgate-production.up.railway.app/#workflow-sprint-intake,Use proof links only after the buyer confirms the workflow pain.,"Appreciate the kind words on the Thompson Sampling approach. You nailed the core insight: most guardrails are brittle prompt hacks that break when context shifts. I am looking for one AI-agent workflow to harden end-to-end this week: repeated failure, prevention rule, and proof run. If you have a workflow where brittle guardrails keep failing, I can harden that workflow with you. Open to a 15-minute diagnostic?","If your workflow really has one repeated workflow failure blocking rollout, I can send the Workflow Hardening Sprint brief plus the commercial truth and verification evidence: https://thumbgate-production.up.railway.app/#workflow-sprint-intake Commercial truth: https://github.com/IgorGanapolsky/ThumbGate/blob/main/docs/COMMERCIAL_TRUTH.md Verification evidence: https://github.com/IgorGanapolsky/ThumbGate/blob/main/docs/VERIFICATION_EVIDENCE.md",npm run sales:pipeline -- advance --lead 'reddit_enthu_cutlet_1337_r_claudecode' --channel 'reddit_dm' --stage 'contacted' --note 'Sent Workflow Hardening Sprint first touch focused on brittle guardrails.',
self_serve_closes,Self-Serve Closes,1,opensesh — KARIMO,cold,targeted,github,github,github_opensesh_karimo,opensesh,opensesh,KARIMO,https://github.com/opensesh/KARIMO,opensession,https://link.opensession.co/github,17,workflow control surface; production or platform workflow; agent infrastructure; self-serve agent tooling; 34 GitHub stars; updated in the last 7 days,pro,pro_self_serve,"Target looks like a local hook, plugin, or config surface, so start with the setup guide and Pro follow-on before pitching a sprint.",https://thumbgate-production.up.railway.app/guide,Use proof links only after the buyer confirms the workflow pain.,"Hey @opensesh, saw you're building around `KARIMO`. If you want the clean self-serve tool path first, start with the proof-backed setup guide: https://thumbgate-production.up.railway.app/guide. If one repeated agent mistake is still slowing the workflow down after that, Pro is the clean next step.","If you want the self-serve path for `KARIMO`, here is the live Pro checkout: https://thumbgate-production.up.railway.app/checkout/pro Commercial truth: https://github.com/IgorGanapolsky/ThumbGate/blob/main/docs/COMMERCIAL_TRUTH.md Verification evidence: https://github.com/IgorGanapolsky/ThumbGate/blob/main/docs/VERIFICATION_EVIDENCE.md",npm run sales:pipeline -- advance --lead 'github_opensesh_karimo' --channel 'manual' --stage 'contacted' --note 'Sent Pro at $19/mo or $149/yr self-serve first touch focused on the proof-backed setup guide and local-first enforcement before any team-motion pitch.',
self_serve_closes,Self-Serve Closes,2,BaseInfinity — claude-sdlc-wizard,cold,targeted,github,github,github_baseinfinity_claude_sdlc_wizard,BaseInfinity,BaseInfinity,claude-sdlc-wizard,https://github.com/BaseInfinity/claude-sdlc-wizard,,https://www.youtube.com/@Basecase_/featured,14,workflow control surface; production or platform workflow; self-serve agent tooling; 10 GitHub stars; updated in the last 7 days,pro,pro_self_serve,"Target looks like a local hook, plugin, or config surface, so start with the setup guide and Pro follow-on before pitching a sprint.",https://thumbgate-production.up.railway.app/guide,Use proof links only after the buyer confirms the workflow pain.,"Hey @BaseInfinity, saw you're building around `claude-sdlc-wizard`. If you want the clean self-serve tool path first, start with the proof-backed setup guide: https://thumbgate-production.up.railway.app/guide. If one repeated agent mistake is still slowing the workflow down after that, Pro is the clean next step.","If you want the self-serve path for `claude-sdlc-wizard`, here is the live Pro checkout: https://thumbgate-production.up.railway.app/checkout/pro Commercial truth: https://github.com/IgorGanapolsky/ThumbGate/blob/main/docs/COMMERCIAL_TRUTH.md Verification evidence: https://github.com/IgorGanapolsky/ThumbGate/blob/main/docs/VERIFICATION_EVIDENCE.md",npm run sales:pipeline -- advance --lead 'github_baseinfinity_claude_sdlc_wizard' --channel 'manual' --stage 'contacted' --note 'Sent Pro at $19/mo or $149/yr self-serve first touch focused on the proof-backed setup guide and local-first enforcement before any team-motion pitch.',
self_serve_closes,Self-Serve Closes,3,zaxbysauce — opencode-swarm,cold,targeted,github,github,github_zaxbysauce_opencode_swarm,zaxbysauce,zaxbysauce,opencode-swarm,https://github.com/zaxbysauce/opencode-swarm,,https://github.com/zaxbysauce,12,workflow control surface; self-serve agent tooling; 248 GitHub stars; updated in the last 7 days,pro,pro_self_serve,"Target looks like a local hook, plugin, or config surface, so start with the setup guide and Pro follow-on before pitching a sprint.",https://thumbgate-production.up.railway.app/guide,Use proof links only after the buyer confirms the workflow pain.,"Hey @zaxbysauce, saw you're building around `opencode-swarm`. If you want the clean self-serve tool path first, start with the proof-backed setup guide: https://thumbgate-production.up.railway.app/guide. If one repeated agent mistake is still slowing the workflow down after that, Pro is the clean next step.","If you want the self-serve path for `opencode-swarm`, here is the live Pro checkout: https://thumbgate-production.up.railway.app/checkout/pro Commercial truth: https://github.com/IgorGanapolsky/ThumbGate/blob/main/docs/COMMERCIAL_TRUTH.md Verification evidence: https://github.com/IgorGanapolsky/ThumbGate/blob/main/docs/VERIFICATION_EVIDENCE.md",npm run sales:pipeline -- advance --lead 'github_zaxbysauce_opencode_swarm' --channel 'manual' --stage 'contacted' --note 'Sent Pro at $19/mo or $149/yr self-serve first touch focused on the proof-backed setup guide and local-first enforcement before any team-motion pitch.',
cold_github,Cold GitHub,1,Abhi268170 — Stagix,cold,targeted,github,github,github_abhi268170_stagix,Abhi268170,Abhi268170,Stagix,https://github.com/Abhi268170/Stagix,,https://github.com/Abhi268170,15,workflow control surface; production or platform workflow; business-system integration; agent infrastructure; self-serve agent tooling,sprint,workflow_hardening_sprint,"Lead with one business-system workflow that needs approval boundaries, rollback safety, and proof.",https://thumbgate-production.up.railway.app/#workflow-sprint-intake,Use proof links only after the buyer confirms the workflow pain.,"Hey @Abhi268170, saw you're shipping `Stagix`. If one approval, handoff, or rollback step keeps creating trouble, I can harden that workflow for you with a prevention gate and proof run: https://thumbgate-production.up.railway.app/#workflow-sprint-intake","If `Stagix` really has one repeated workflow failure blocking rollout, I can send the Workflow Hardening Sprint brief plus the commercial truth and verification evidence: https://thumbgate-production.up.railway.app/#workflow-sprint-intake Commercial truth: https://github.com/IgorGanapolsky/ThumbGate/blob/main/docs/COMMERCIAL_TRUTH.md Verification evidence: https://github.com/IgorGanapolsky/ThumbGate/blob/main/docs/VERIFICATION_EVIDENCE.md","npm run sales:pipeline -- advance --lead 'github_abhi268170_stagix' --channel 'manual' --stage 'contacted' --note 'Sent Workflow Hardening Sprint first touch focused on one business-system workflow that needs approval boundaries, rollback safety, and proof.'",
cold_github,Cold GitHub,2,Adqui9608 — ai-code-review-agent,cold,targeted,github,github,github_adqui9608_ai_code_review_agent,Adqui9608,Adqui9608,ai-code-review-agent,https://github.com/Adqui9608/ai-code-review-agent,,https://github.com/Adqui9608,15,workflow control surface; production or platform workflow; business-system integration; agent infrastructure; updated in the last 7 days,sprint,workflow_hardening_sprint,"Lead with one business-system workflow that needs approval boundaries, rollback safety, and proof.",https://thumbgate-production.up.railway.app/#workflow-sprint-intake,Use proof links only after the buyer confirms the workflow pain.,"Hey @Adqui9608, saw you're shipping `ai-code-review-agent`. If one approval, handoff, or rollback step keeps creating trouble, I can harden that workflow for you with a prevention gate and proof run: https://thumbgate-production.up.railway.app/#workflow-sprint-intake","If `ai-code-review-agent` really has one repeated workflow failure blocking rollout, I can send the Workflow Hardening Sprint brief plus the commercial truth and verification evidence: https://thumbgate-production.up.railway.app/#workflow-sprint-intake Commercial truth: https://github.com/IgorGanapolsky/ThumbGate/blob/main/docs/COMMERCIAL_TRUTH.md Verification evidence: https://github.com/IgorGanapolsky/ThumbGate/blob/main/docs/VERIFICATION_EVIDENCE.md","npm run sales:pipeline -- advance --lead 'github_adqui9608_ai_code_review_agent' --channel 'manual' --stage 'contacted' --note 'Sent Workflow Hardening Sprint first touch focused on one business-system workflow that needs approval boundaries, rollback safety, and proof.'",
cold_github,Cold GitHub,3,dolutech — engine_context,cold,targeted,github,github,github_dolutech_engine_context,dolutech,dolutech,engine_context,https://github.com/dolutech/engine_context,@dolutech,https://dolutech.com/,15,workflow control surface; production or platform workflow; business-system integration; agent infrastructure; 8 GitHub stars,sprint,workflow_hardening_sprint,"Lead with one business-system workflow that needs approval boundaries, rollback safety, and proof.",https://thumbgate-production.up.railway.app/#workflow-sprint-intake,Use proof links only after the buyer confirms the workflow pain.,"Hey @dolutech, saw you're shipping `engine_context`. If one approval, handoff, or rollback step keeps creating trouble, I can harden that workflow for you with a prevention gate and proof run: https://thumbgate-production.up.railway.app/#workflow-sprint-intake","If `engine_context` really has one repeated workflow failure blocking rollout, I can send the Workflow Hardening Sprint brief plus the commercial truth and verification evidence: https://thumbgate-production.up.railway.app/#workflow-sprint-intake Commercial truth: https://github.com/IgorGanapolsky/ThumbGate/blob/main/docs/COMMERCIAL_TRUTH.md Verification evidence: https://github.com/IgorGanapolsky/ThumbGate/blob/main/docs/VERIFICATION_EVIDENCE.md","npm run sales:pipeline -- advance --lead 'github_dolutech_engine_context' --channel 'manual' --stage 'contacted' --note 'Sent Workflow Hardening Sprint first touch focused on one business-system workflow that needs approval boundaries, rollback safety, and proof.'",
